<?xml version="1.0" encoding="UTF-8" standalone="no"?>

<StyleDefinition
 xmlns="http://www.yworks.com/xml/ydocstyle"
 xmlns:xsi="http://www.w3.org/2001/XMLSchema-instance"
 xsi:schemaLocation="http://www.yworks.com/xml/ydocstyle http://www.yworks.com/xml/schema/ydoc/1.0/ydocstyle.xsd">

<!--
LightGray   X   211;211;211 D3D3D3
SlateGray3  X   159;182;205 9FB6CD
LightSteelBlue1 202;225;255 CAE1FF
SlateGray3  X   159;182;205 9FB6CD - the gradient class/enum name areas
-->
  <NodeStyle
   constraint.label.font="Dialog-plain-12"
   constraint.label.text=""
   constraint.label.text.color="#000000"
   constructors.fill.color=""
   constructors.font="Dialog-plain-12"
   constructors.gradient.color=""
   constructors.text.color="#000000"
   fields.fill.color=""
   fields.font="Dialog-plain-12"
   fields.gradient.color=""
   fields.text.color="#000000"
   header.fill.color="#FFFFFF"
   header.gradient.color="#FFFFFF"
   header.style="default"
   icon.style="high-quality"
   line.color="#000000"
   line.stroke="line_1"
   methods.fill.color=""
   methods.font="Dialog-plain-12"
   methods.gradient.color=""
   methods.text.color="#000000"
   name.label.font="Dialog-bold-14"
   name.label.text.color="#000000"
   section.fill.color="#FFFFFF"
   section.gradient.color=""
   separator.fill.color=""
   separator.style="fixed"
   shadow.color="#D8D8D8"
   shadow.height="5"
   shadow.style="solid"
   shadow.width="5"
   shape="roundrectangle"
   stereotype.label.font="Dialog-plain-12"
   stereotype.label.text=""
   stereotype.label.text.color="#000000"
   styleId="node-type"
   type.label.font="Dialog-plain-12"
   type.label.text=""
   type.label.text.color="#000000"/>
  <NodeStyle
   line.color="#9A9892"
   section.fill.color="#F3F3F3"
   separator.fill.color="#606060"
   styleId="classifier"
   styleRef="node-type"/>
  <NodeStyle
   header.fill.color="#9FB6CD"
   header.style="span_section"
   line.color="#C8CDDE"
   section.fill.color="#D3D3D3"
   styleId="group"
   styleRef="node-type"/>
  <NodeStyle
   header.fill.color="#CAE1FF"
   header.style="left_tab"
   line.color="#C8CDDE"
   name.label.font="Dialog-bold-14"
   section.fill.color="#D3D3D3"
   shape="rectangle"
   styleId="package"
   styleRef="node-type"/>
  <NodeStyle
   constraint.label.font="Dialog-plain-12"
   constructors.fill.color="#CAE1FF"
   fields.fill.color="#CAE1FF"
   header.fill.color="#9FB6CD"
   line.color="#D3D377"
   methods.fill.color="#CAE1FF"
   separator.fill.color="#D3D377"
   shape="rectangle"
   styleId="annotation"
   styleRef="classifier"/>
  <NodeStyle
   styleId="annotation.compact"
   styleRef="annotation"/>
  <NodeStyle
   constructors.fill.color="#CAE1FF"
   fields.fill.color="#CAE1FF"
   header.fill.color="#9FB6CD"
   methods.fill.color="#CAE1FF"
   separator.fill.color="#E5E7E9"
   styleId="class"
   styleRef="classifier"/>
  <NodeStyle
   constructors.fill.color="#CAE1FF"
   fields.fill.color="#CAE1FF"
   header.fill.color="#9FB6CD"
   methods.fill.color="#CAE1FF"
   separator.fill.color="#DFDEE3"
   shape="rectangle"
   styleId="enum"
   styleRef="classifier"/>
  <NodeStyle
   constructors.fill.color="#CAE1FF"
   fields.fill.color="#CAE1FF"
   fields.font="Dialog-italic-12"
   header.fill.color="#9FB6CD"
   methods.fill.color="#CAE1FF"
   methods.font="Dialog-italic-12"
   separator.fill.color="#EBEBEB"
   styleId="interface"
   styleRef="classifier"/>
  <NodeStyle
   styleId="concreteclass"
   styleRef="class"/>
  <NodeStyle
   styleId="annotation.detailed"
   styleRef="annotation"/>
  <NodeStyle
   styleId="enum.compact"
   styleRef="enum"/>
  <NodeStyle
   styleId="interface.detailed"
   styleRef="interface"/>
  <NodeStyle
   styleId="exception"
   styleRef="class"/>
  <NodeStyle
   styleId="class.compact"
   styleRef="concreteclass"/>
  <NodeStyle
   styleId="class.detailed"
   styleRef="concreteclass"/>
  <NodeStyle
   line.stroke="dashed_1"
   name.label.font="Dialog-bolditalic-14"
   styleId="abstract"
   styleRef="class"/>
  <NodeStyle
   styleId="enum.detailed"
   styleRef="enum"/>
  <NodeStyle
   styleId="error"
   styleRef="class"/>
  <NodeStyle
   styleId="interface.compact"
   styleRef="interface"/>
  <NodeStyle
   styleId="error.compact"
   styleRef="error"/>
  <NodeStyle
   styleId="exception.compact"
   styleRef="exception"/>
  <NodeStyle
   styleId="exception.detailed"
   styleRef="exception"/>
  <NodeStyle
   styleId="abstract.compact"
   styleRef="abstract"/>
  <NodeStyle
   styleId="abstract.detailed"
   styleRef="abstract"/>
  <NodeStyle
   styleId="error.detailed"
   styleRef="error"/>
  <EdgeStyle
   bend.style="smooth"
   line.color="#9A9A9A"
   line.stroke="line_1"
   source.arrow="none"
   styleId="relationship"
   target.arrow="none"/>
  <EdgeStyle
   bend.style="smooth"
   line.stroke="dashed_1"
   source.arrow="none"
   styleId="dependency"
   styleRef="relationship"
   target.arrow="UML:Wedge"/>
  <EdgeStyle
   bend.style="smooth"
   line.stroke="dashed_1"
   styleId="realization"
   styleRef="relationship"
   target.arrow="white_delta"/>
  <EdgeStyle
   styleId="association"
   styleRef="relationship"/>
  <EdgeStyle
   bend.style="smooth"
   styleId="generalization"
   styleRef="relationship"
   target.arrow="white_delta"/>
</StyleDefinition>
