<?xml version="1.0" encoding="UTF-8"?>
<StyleDefinition
 xmlns="http://www.yworks.com/xml/ydocstyle"
 xmlns:xsi="http://www.w3.org/2001/XMLSchema-instance"
 xsi:schemaLocation="http://www.yworks.com/xml/ydocstyle http://www.yworks.com/xml/schema/ydoc/1.0/ydocstyle.xsd">
  <NodeStyle
   styleId="node-type"
   shadow.color=""
   shadow.width="0"
   shadow.height="0"
   shadow.style="solid"
   line.color="#000000"
   line.stroke="line_1"
   header.fill.color=""
   header.gradient.color=""
   header.style="default"
   icon.style="ascii"
   section.fill.color=""
   section.gradient.color=""
   separator.fill.color=""
   separator.style="fixed"
   shape="rectangle"
   constraint.label.font="Dialog-plain-12"
   constraint.label.text=""
   constraint.label.text.color="#000000"
   name.label.font="Dialog-plain-12"
   name.label.text.color="#000000"
   stereotype.label.font="Dialog-plain-12"
   stereotype.label.text=""
   stereotype.label.text.color="#000000"
   type.label.font="Dialog-plain-12"
   type.label.text=""
   type.label.text.color="#000000"
   fields.fill.color=""
   fields.gradient.color=""
   fields.font="Dialog-plain-12"
   fields.text.color="#000000"
   constructors.fill.color=""
   constructors.gradient.color=""
   constructors.font="Dialog-plain-12"
   constructors.text.color="#000000"
   methods.fill.color=""
   methods.gradient.color=""
   methods.font="Dialog-plain-12"
   methods.text.color="#000000"/>
  <NodeStyle
   styleId="group"
   styleRef="node-type"
   line.color="#B2B2B2"
   header.fill.color="#FFFFFF"
   section.fill.color="#FFFFFF"
   separator.style="dynamic"
   shape="roundrectangle"/>
  <NodeStyle
   styleId="classifier"
   styleRef="node-type"
   separator.fill.color="#000000"/>
  <NodeStyle
   styleId="enum"
   styleRef="classifier"
   line.color="#7676B2"
   header.fill.color="#E3EEFE"
   fields.fill.color="#E3EEFE"
   constructors.fill.color="#E3EEFE"
   methods.fill.color="#E3EEFE"/>
  <NodeStyle
   styleId="enum.compact"
   styleRef="enum"
   name.label.font="Dialog-bold-13"/>
  <NodeStyle
   styleId="error"
   styleRef="classifier"
   line.color="#6464B2"
   header.fill.color="#E3EEFE"
   fields.fill.color="#E3EEFE"
   constructors.fill.color="#E3EEFE"
   methods.fill.color="#E3EEFE"/>
  <NodeStyle
   styleId="abstract"
   styleRef="classifier"
   line.color="#8E8EB2"
   header.fill.color="#FFDEAA"
   fields.fill.color="#FFDEAA"
   constructors.fill.color="#FFDEAA"
   methods.fill.color="#FFDEAA"/>
  <NodeStyle
   styleId="error.detailed"
   styleRef="error"
   name.label.font="Dialog-bold-16"
   stereotype.label.text="«error»"/>
  <NodeStyle
   styleId="package"
   styleRef="node-type"
   line.color="#B2BFFF"
   header.fill.color="#FAFAFA"
   header.style="left_tab"
   section.fill.color="#FAFAFA"
   separator.style="dynamic"
   shape="roundrectangle"/>
  <NodeStyle
   styleId="annotation"
   styleRef="classifier"
   line.color="#9494B2"
   header.fill.color="#D4FFCB"
   fields.fill.color="#D4FFCB"
   constructors.fill.color="#D4FFCB"
   methods.fill.color="#D4FFCB"/>
  <NodeStyle
   styleId="enum.detailed"
   styleRef="enum"
   name.label.font="Dialog-bold-16"
   stereotype.label.text="«enum»"/>
  <NodeStyle
   styleId="abstract.compact"
   styleRef="abstract"
   name.label.font="Dialog-bold-13"/>
  <NodeStyle
   styleId="exception"
   styleRef="classifier"
   line.color="#6A6AB2"
   header.fill.color="#E3EEFE"
   fields.fill.color="#E3EEFE"
   constructors.fill.color="#E3EEFE"
   methods.fill.color="#E3EEFE"/>
  <NodeStyle
   styleId="interface"
   styleRef="classifier"
   line.color="#9A9AB2"
   header.fill.color="#D4FFCB"
   fields.fill.color="#D4FFCB"
   constructors.fill.color="#D4FFCB"
   methods.fill.color="#D4FFCB"
   constraint.label.font="Dialog-italic-12"
   name.label.font="Dialog-italic-12"
   type.label.font="Dialog-italic-12"/>
  <NodeStyle
   styleId="interface.detailed"
   styleRef="interface"
   name.label.font="Dialog-bolditalic-16"
   stereotype.label.text="«interface»"/>
  <NodeStyle
   styleId="error.compact"
   styleRef="error"
   name.label.font="Dialog-bold-13"/>
  <NodeStyle
   styleId="exception.compact"
   styleRef="exception"
   name.label.font="Dialog-bold-13"/>
  <NodeStyle
   styleId="annotation.compact"
   styleRef="annotation"
   shape="ellipse"
   name.label.font="Dialog-bold-13"/>
  <NodeStyle
   styleId="annotation.detailed"
   styleRef="annotation"
   name.label.font="Dialog-bold-16"
   stereotype.label.text="«annotation»"/>
  <NodeStyle
   styleId="class"
   styleRef="classifier"
   line.color="#8282B2"
   header.fill.color="#E3EEFE"
   fields.fill.color="#E3EEFE"
   constructors.fill.color="#E3EEFE"
   methods.fill.color="#E3EEFE"/>
  <NodeStyle
   styleId="exception.detailed"
   styleRef="exception"
   name.label.font="Dialog-bold-16"
   stereotype.label.text="«exception»"/>
  <NodeStyle
   styleId="abstract.detailed"
   styleRef="abstract"
   constraint.label.text="{abstract}"
   name.label.font="Dialog-bold-16"/>
  <NodeStyle
   styleId="class.detailed"
   styleRef="class"
   name.label.font="Dialog-bold-16"/>
  <NodeStyle
   styleId="interface.compact"
   styleRef="interface"
   shape="ellipse"
   name.label.font="Dialog-bolditalic-13"/>
  <NodeStyle
   styleId="class.compact"
   styleRef="class"
   name.label.font="Dialog-bold-13"/>
  <EdgeStyle
   styleId="relationship"
   line.color="#000000"
   line.stroke="line_1"
   bend.style="angled"
   source.arrow="none"
   target.arrow="none"/>
  <EdgeStyle
   styleId="realization"
   styleRef="relationship"
   line.stroke="dashed_1"
   target.arrow="white_delta"/>
  <EdgeStyle
   styleId="generalization"
   styleRef="relationship"
   target.arrow="white_delta"/>
  <EdgeStyle
   styleId="association"
   styleRef="relationship"
   target.arrow="UML:Wedge"/>
  <EdgeStyle
   styleId="dependency"
   styleRef="relationship"
   line.stroke="dashed_1"
   target.arrow="UML:Wedge"/>
</StyleDefinition>
