<?xml version="1.0" encoding="UTF-8"?>
<StyleDefinition
 xmlns="http://www.yworks.com/xml/ydocstyle"
 xmlns:xsi="http://www.w3.org/2001/XMLSchema-instance"
 xsi:schemaLocation="http://www.yworks.com/xml/ydocstyle http://www.yworks.com/xml/schema/ydoc/1.0/ydocstyle.xsd">
  <NodeStyle
   styleId="node-type"
   shadow.color="#B3A691"
   shadow.width="5"
   shadow.height="5"
   shadow.style="solid"
   line.color="#000000"
   line.stroke="line_1"
   header.fill.color="#FFFFFF"
   header.gradient.color=""
   header.style="default"
   icon.style="ascii"
   separator.fill.color=""
   separator.style="fixed"
   shape="roundrectangle"
   section.fill.color=""
   section.gradient.color=""
   constraint.label.font="Dialog-plain-12"
   constraint.label.text=""
   constraint.label.text.color="#000000"
   name.label.font="Dialog-plain-12"
   name.label.text.color="#000000"
   stereotype.label.font="Dialog-plain-12"
   stereotype.label.text=""
   stereotype.label.text.color="#000000"
   type.label.font="Dialog-plain-12"
   type.label.text=""
   type.label.text.color="#000000"
   fields.fill.color=""
   fields.gradient.color=""
   fields.font="Dialog-plain-12"
   fields.text.color="#000000"
   constructors.fill.color=""
   constructors.gradient.color=""
   constructors.font="Dialog-plain-12"
   constructors.text.color="#000000"
   methods.fill.color=""
   methods.gradient.color=""
   methods.font="Dialog-plain-12"
   methods.text.color="#000000"/>
  <NodeStyle
   styleId="group"
   styleRef="node-type"
   header.gradient.color="#FFA70F"
   separator.style="dynamic"
   section.fill.color="#FFFFFF"
   name.label.font="Dialog-bold-14"/>
  <NodeStyle
   styleId="classifier"
   styleRef="node-type"
   icon.style="vectorgraphics"
   separator.fill.color="#606060"
   fields.fill.color="#F3F3F3"
   constructors.fill.color="#F3F3F3"
   methods.fill.color="#F3F3F3"/>
  <NodeStyle
   styleId="enum"
   styleRef="classifier"
   header.gradient.color="#09B5D4"
   type.label.text="enum"/>
  <NodeStyle
   styleId="error"
   styleRef="classifier"
   header.gradient.color="#700000"
   type.label.text="error"/>
  <NodeStyle
   styleId="enum.compact"
   styleRef="enum"
   name.label.font="Dialog-bold-13"/>
  <NodeStyle
   styleId="abstract"
   styleRef="classifier"
   header.gradient.color="#FFCC00"
   type.label.text="abstract"/>
  <NodeStyle
   styleId="error.detailed"
   styleRef="error"
   name.label.font="Dialog-bold-16"/>
  <NodeStyle
   styleId="package"
   styleRef="node-type"
   header.gradient.color="#990099"
   header.style="left_tab"
   separator.style="dynamic"
   section.fill.color="#FFFFFF"
   name.label.font="Dialog-bold-14"/>
  <NodeStyle
   styleId="annotation"
   styleRef="classifier"
   header.gradient.color="#7D4AAC"/>
  <NodeStyle
   styleId="exception"
   styleRef="classifier"
   header.gradient.color="#CC0000"
   type.label.text="exception"/>
  <NodeStyle
   styleId="abstract.compact"
   styleRef="abstract"
   name.label.font="Dialog-bold-13"/>
  <NodeStyle
   styleId="enum.detailed"
   styleRef="enum"
   name.label.font="Dialog-bold-16"/>
  <NodeStyle
   styleId="interface"
   styleRef="classifier"
   header.gradient.color="#99CC00"/>
  <NodeStyle
   styleId="interface.detailed"
   styleRef="interface"
   name.label.font="Dialog-bold-16"
   stereotype.label.text="&#171;interface&#187;"/>
  <NodeStyle
   styleId="error.compact"
   styleRef="error"
   name.label.font="Dialog-bold-13"/>
  <NodeStyle
   styleId="exception.compact"
   styleRef="exception"
   name.label.font="Dialog-bold-13"/>
  <NodeStyle
   styleId="annotation.compact"
   styleRef="annotation"
   shape="ellipse"
   name.label.font="Dialog-bold-13"/>
  <NodeStyle
   styleId="class"
   styleRef="classifier"
   header.gradient.color="#99CCFF"
   type.label.text="class"/>
  <NodeStyle
   styleId="annotation.detailed"
   styleRef="annotation"
   name.label.font="Dialog-bold-16"
   stereotype.label.text="&#171;annotation&#187;"/>
  <NodeStyle
   styleId="exception.detailed"
   styleRef="exception"
   name.label.font="Dialog-bold-16"/>
  <NodeStyle
   styleId="abstract.detailed"
   styleRef="abstract"
   name.label.font="Dialog-bold-16"/>
  <NodeStyle
   styleId="class.detailed"
   styleRef="class"
   name.label.font="Dialog-bold-16"/>
  <NodeStyle
   styleId="interface.compact"
   styleRef="interface"
   shape="ellipse"
   name.label.font="Dialog-bold-13"/>
  <NodeStyle
   styleId="class.compact"
   styleRef="class"
   name.label.font="Dialog-bold-13"/>
  <EdgeStyle
   styleId="relationship"
   line.color="#000000"
   line.stroke="line_1"
   bend.style="angled"
   source.arrow="none"
   target.arrow="none"/>
  <EdgeStyle
   styleId="realization"
   styleRef="relationship"
   line.stroke="dashed_1"
   target.arrow="white_delta"/>
  <EdgeStyle
   styleId="generalization"
   styleRef="relationship"
   target.arrow="white_delta"/>
  <EdgeStyle
   styleId="association"
   styleRef="relationship"
   target.arrow="UML:Wedge"/>
  <EdgeStyle
   styleId="dependency"
   styleRef="relationship"
   line.stroke="dashed_1"
   target.arrow="UML:Wedge"/>
</StyleDefinition>
