<?xml version="1.0" encoding="UTF-8" standalone="no"?>
<StyleDefinition
 xmlns="http://www.yworks.com/xml/ydocstyle"
 xmlns:xsi="http://www.w3.org/2001/XMLSchema-instance"
 xsi:schemaLocation="http://www.yworks.com/xml/ydocstyle http://www.yworks.com/xml/schema/ydoc/1.0/ydocstyle.xsd">
  <NodeStyle
   constraint.label.font="Dialog-plain-12"
   constraint.label.text=""
   constraint.label.text.color="#000000"
   constructors.fill.color=""
   constructors.font="Dialog-plain-12"
   constructors.gradient.color=""
   constructors.text.color="#000000"
   fields.fill.color=""
   fields.font="Dialog-plain-12"
   fields.gradient.color=""
   fields.text.color="#000000"
   header.fill.color="#FFFFFF"
   header.gradient.color=""
   header.style="span_section"
   icon.style="vectorgraphics"
   line.color="#999999"
   line.stroke="line_1"
   methods.fill.color=""
   methods.font="Dialog-plain-12"
   methods.gradient.color=""
   methods.text.color="#000000"
   name.label.font="Dialog-plain-12"
   name.label.text.color="#000000"
   section.fill.color=""
   section.gradient.color=""
   separator.fill.color=""
   separator.style="fixed"
   shadow.color="#B3A691"
   shadow.height="1"
   shadow.style="solid"
   shadow.width="1"
   shape="roundrectangle"
   stereotype.label.font="Dialog-plain-12"
   stereotype.label.text=""
   stereotype.label.text.color="#000000"
   styleId="node-type"
   type.label.font="Dialog-plain-12"
   type.label.text=""
   type.label.text.color="#000000"/>
  <NodeStyle
   constructors.fill.color="#F3F3F3"
   fields.fill.color="#F3F3F3"
   line.color="#CCCCCC"
   methods.fill.color="#F3F3F3"
   separator.fill.color="#CCCCCC"
   styleId="classifier"
   styleRef="node-type"/>
  <NodeStyle
   header.fill.color="#E66E6E"
   line.color="#BD5555"
   name.label.font="Dialog-bold-14"
   section.fill.color="#F0F0F0"
   separator.style="dynamic"
   styleId="group"
   styleRef="node-type"/>
  <NodeStyle
   header.fill.color="#91B9FF"
   styleId="exception"
   styleRef="classifier"
   type.label.text="exception"/>
  <NodeStyle
   header.fill.color="#B4B4B4"
   line.color="#999999"
   name.label.font="Dialog-bold-14"
   section.fill.color="#F0F0F0"
   separator.style="dynamic"
   styleId="package"
   styleRef="node-type"/>
  <NodeStyle
   header.fill.color="#91BE91"
   styleId="annotation"
   styleRef="classifier"/>
  <NodeStyle
   name.label.font="Dialog-plain-12"
   shape="ellipse"
   styleId="annotation.compact"
   styleRef="annotation"/>
  <NodeStyle
   header.fill.color="#FAD27D"
   styleId="abstract"
   styleRef="classifier"
   type.label.text="abstract"/>
  <NodeStyle
   header.fill.color="#91B9FF"
   styleId="error"
   styleRef="classifier"
   type.label.text="error"/>
  <NodeStyle
   header.fill.color="#91B9FF"
   styleId="class"
   styleRef="classifier"
   type.label.text="class"/>
  <NodeStyle
   header.fill.color="#91B9FF"
   styleId="enum"
   styleRef="classifier"
   type.label.text="enum"/>
  <NodeStyle
   constructors.fill.color="#EBEBD7"
   fields.fill.color="#EBEBD7"
   header.fill.color="#91BE91"
   methods.fill.color="#EBEBD7"
   styleId="interface"
   styleRef="classifier"/>
  <NodeStyle
   name.label.font="Dialog-plain-12"
   styleId="error.compact"
   styleRef="error"/>
  <NodeStyle
   name.label.font="Dialog-bold-16"
   stereotype.label.text="«annotation»"
   styleId="annotation.detailed"
   styleRef="annotation"/>
  <NodeStyle
   name.label.font="Dialog-plain-12"
   styleId="exception.compact"
   styleRef="exception"/>
  <NodeStyle
   name.label.font="Dialog-bold-16"
   styleId="exception.detailed"
   styleRef="exception"/>
  <NodeStyle
   name.label.font="Dialog-plain-12"
   styleId="enum.compact"
   styleRef="enum"/>
  <NodeStyle
   name.label.font="Dialog-bold-16"
   stereotype.label.text="«interface»"
   styleId="interface.detailed"
   styleRef="interface"/>
  <NodeStyle
    name.label.font="Dialog-plain-12"
   styleId="abstract.compact"
   styleRef="abstract"/>
  <NodeStyle
   methods.fill.color="#EBEDFF"
   name.label.font="Dialog-plain-12"
   section.fill.color="#EBEBFF"
   styleId="class.compact"
   styleRef="class"/>
  <NodeStyle
   constructors.fill.color="#EBEBF5"
   fields.fill.color="#EBEBF5"
   methods.fill.color="#EBEBF5"
   name.label.font="Dialog-bold-16"
   styleId="class.detailed"
   styleRef="class"/>
  <NodeStyle
   name.label.font="Dialog-bold-16"
   styleId="error.detailed"
   styleRef="error"/>
  <NodeStyle
   constructors.fill.color="#FAF0D2"
   fields.fill.color="#FAF0D2"
   header.fill.color="#FAD27D"
   methods.fill.color="#FAF0D2"
   name.label.font="Dialog-bold-16"
   styleId="abstract.detailed"
   styleRef="abstract"/>
  <NodeStyle
   name.label.font="Dialog-bold-16"
   styleId="enum.detailed"
   styleRef="enum"/>
  <NodeStyle
   name.label.font="Dialog-plain-12"
   shape="ellipse"
   styleId="interface.compact"
   styleRef="interface"/>
  <EdgeStyle
   bend.style="angled"
   line.color="#000000"
   line.stroke="dashed_1"
   source.arrow="none"
   styleId="dependency"
   target.arrow="UML:Wedge"/>
  <EdgeStyle
   bend.style="angled"
   line.color="#000000"
   line.stroke="dashed_2"
   source.arrow="none"
   styleId="realization"
   target.arrow="white_delta"/>
  <EdgeStyle
   bend.style="angled"
   line.color="#000000"
   line.stroke="dashed_1"
   source.arrow="none"
   styleId="association"
   target.arrow="short"/>
  <EdgeStyle
   bend.style="angled"
   line.color="#000000"
   line.stroke="line_2"
   source.arrow="none"
   styleId="generalization"
   target.arrow="white_delta"/>
</StyleDefinition>
