<?xml version="1.0" encoding="UTF-8"?>
<StyleDefinition
 xmlns="http://www.yworks.com/xml/ydocstyle"
 xmlns:xsi="http://www.w3.org/2001/XMLSchema-instance"
 xsi:schemaLocation="http://www.yworks.com/xml/ydocstyle http://www.yworks.com/xml/schema/ydoc/1.0/ydocstyle.xsd">
  <NodeStyle
   styleId="node-type"
   shadow.color=""
   shadow.width="0"
   shadow.height="0"
   shadow.style="solid"
   line.color="#000000"
   line.stroke="line_1"
   header.fill.color="#FFFFFF"
   header.gradient.color=""
   header.style="default"
   icon.style="ascii"
   separator.fill.color=""
   separator.style="fixed"
   shape="rectangle"
   section.fill.color="#FFFFFF"
   section.gradient.color=""
   constraint.label.font="Dialog-plain-12"
   constraint.label.text=""
   constraint.label.text.color="#000000"
   name.label.font="Dialog-bold-14"
   name.label.text.color="#000000"
   stereotype.label.font="Dialog-plain-12"
   stereotype.label.text=""
   stereotype.label.text.color="#000000"
   type.label.font="Dialog-plain-12"
   type.label.text=""
   type.label.text.color="#000000"
   fields.fill.color=""
   fields.gradient.color=""
   fields.font="Dialog-plain-12"
   fields.text.color="#000000"
   constructors.fill.color=""
   constructors.gradient.color=""
   constructors.font="Dialog-plain-12"
   constructors.text.color="#000000"
   methods.fill.color=""
   methods.gradient.color=""
   methods.font="Dialog-plain-12"
   methods.text.color="#000000"/>
  <NodeStyle
   styleId="group"
   styleRef="node-type"
   header.style="span_section"/>
  <NodeStyle
   styleId="classifier"
   styleRef="node-type"
   section.fill.color="#F3F3F3"
   separator.fill.color="#606060"/>
  <NodeStyle
   styleId="enum"
   styleRef="classifier"/>
  <NodeStyle
   styleId="error"
   styleRef="classifier"/>
  <NodeStyle
   styleId="enum.compact"
   styleRef="enum"/>
  <NodeStyle
   styleId="abstract"
   styleRef="classifier"/>
  <NodeStyle
   styleId="error.detailed"
   styleRef="error"/>
  <NodeStyle
   styleId="package"
   styleRef="node-type"
   header.style="left_tab"/>
  <NodeStyle
   styleId="annotation"
   styleRef="classifier"/>
  <NodeStyle
   styleId="exception"
   styleRef="classifier"/>
  <NodeStyle
   styleId="enum.detailed"
   styleRef="enum"/>
  <NodeStyle
   styleId="abstract.compact"
   styleRef="abstract"/>
  <NodeStyle
   styleId="interface"
   styleRef="classifier"/>
  <NodeStyle
   styleId="interface.detailed"
   styleRef="interface"/>
  <NodeStyle
   styleId="error.compact"
   styleRef="error"/>
  <NodeStyle
   styleId="exception.compact"
   styleRef="exception"/>
  <NodeStyle
   styleId="annotation.compact"
   styleRef="annotation"/>
  <NodeStyle
   styleId="class"
   styleRef="classifier"/>
  <NodeStyle
   styleId="annotation.detailed"
   styleRef="annotation"/>
  <NodeStyle
   styleId="exception.detailed"
   styleRef="exception"/>
  <NodeStyle
   styleId="abstract.detailed"
   styleRef="abstract"/>
  <NodeStyle
   styleId="class.detailed"
   styleRef="class"/>
  <NodeStyle
   styleId="interface.compact"
   styleRef="interface"/>
  <NodeStyle
   styleId="class.compact"
   styleRef="class"/>
  <EdgeStyle
   styleId="relationship"
   line.color="#000000"
   line.stroke="line_1"
   bend.style="angled"
   source.arrow="none"
   target.arrow="none"/>
  <EdgeStyle
   styleId="realization"
   styleRef="relationship"
   line.stroke="dashed_1"
   target.arrow="white_delta"/>
  <EdgeStyle
   styleId="generalization"
   styleRef="relationship"
   target.arrow="white_delta"/>
  <EdgeStyle
   styleId="association"
   styleRef="relationship"/>
  <EdgeStyle
   styleId="dependency"
   styleRef="relationship"
   line.stroke="dashed_1"
   source.arrow="none"
   target.arrow="UML:Wedge"/>
</StyleDefinition>
