<?xml version="1.0" encoding="UTF-8"?>
<StyleDefinition
 xmlns="http://www.yworks.com/xml/ydocstyle"
 xmlns:xsi="http://www.w3.org/2001/XMLSchema-instance"
 xsi:schemaLocation="http://www.yworks.com/xml/ydocstyle http://www.yworks.com/xml/schema/ydoc/1.0/ydocstyle.xsd">
  <NodeStyle
   styleId="node-type"
   shadow.color="#5B5B5B"
   shadow.width="3"
   shadow.height="3"
   shadow.style="solid"
   line.color="#000000"
   line.stroke="line_1"
   header.fill.color=""
   header.gradient.color=""
   header.style="default"
   icon.style="ascii"
   section.fill.color=""
   section.gradient.color=""
   separator.fill.color="#000000"
   separator.style="fixed"
   shape="roundrectangle"
   constraint.label.font="Dialog-plain-12"
   constraint.label.text=""
   constraint.label.text.color="#000000"
   name.label.font="Dialog-plain-12"
   name.label.text.color="#000000"
   stereotype.label.font="Dialog-plain-12"
   stereotype.label.text=""
   stereotype.label.text.color="#000000"
   type.label.font="Dialog-plain-12"
   type.label.text=""
   type.label.text.color="#000000"
   fields.fill.color=""
   fields.gradient.color=""
   fields.font="Dialog-plain-12"
   fields.text.color="#000000"
   constructors.fill.color=""
   constructors.gradient.color=""
   constructors.font="Dialog-plain-12"
   constructors.text.color="#000000"
   methods.fill.color=""
   methods.gradient.color=""
   methods.font="Dialog-plain-12"
   methods.text.color="#000000"/>
  <NodeStyle
   styleId="group-type"
   styleRef="node-type"
   constraint.label.text.color="#404040"
   name.label.text.color="#404040"
   stereotype.label.text.color="#404040"
   type.label.text.color="#404040"/>
  <NodeStyle
   styleId="group"
   styleRef="group-type"
   header.fill.color="#E6EFFF"
   section.fill.color="#E6EFFF"/>
  <NodeStyle
   styleId="classifier"
   styleRef="node-type"/>
  <NodeStyle
   styleId="abstract"
   styleRef="classifier"
   header.fill.color="#3E7DBC"
   constraint.label.text.color="#C0C0C0"
   name.label.text.color="#C0C0C0"
   stereotype.label.text.color="#C0C0C0"
   type.label.text.color="#C0C0C0"
   fields.fill.color="#3E7DBC"
   fields.text.color="#C0C0C0"
   constructors.fill.color="#3E7DBC"
   constructors.text.color="#C0C0C0"
   methods.fill.color="#3E7DBC"
   methods.text.color="#C0C0C0"/>
  <NodeStyle
   styleId="interface-type"
   styleRef="classifier"
   header.fill.color="#89B5FB"
   constraint.label.text.color="#404040"
   name.label.text.color="#404040"
   stereotype.label.text.color="#404040"
   type.label.text.color="#404040"
   fields.fill.color="#89B5FB"
   fields.text.color="#404040"
   constructors.fill.color="#89B5FB"
   constructors.text.color="#404040"
   methods.fill.color="#89B5FB"
   methods.text.color="#404040"/>
  <NodeStyle
   styleId="package"
   styleRef="group-type"
   header.fill.color="#BFD8FF"
   header.style="left_tab"
   section.fill.color="#BFD8FF"/>
  <NodeStyle
   styleId="class-type"
   styleRef="classifier"
   header.fill.color="#0053A6"
   section.fill.color="#0053A6"
   constraint.label.text.color="#C0C0C0"
   name.label.text.color="#C0C0C0"
   stereotype.label.text.color="#C0C0C0"
   type.label.text.color="#C0C0C0"
   fields.fill.color="#0053A6"
   fields.text.color="#C0C0C0"
   constructors.fill.color="#0053A6"
   constructors.text.color="#C0C0C0"
   methods.fill.color="#0053A6"
   methods.text.color="#C0C0C0"/>
  <NodeStyle
   styleId="annotation"
   styleRef="interface-type"/>
  <NodeStyle
   styleId="abstract.compact"
   styleRef="abstract"
   name.label.font="Dialog-bold-13"/>
  <NodeStyle
   styleId="exception"
   styleRef="class-type"/>
  <NodeStyle
   styleId="interface"
   styleRef="interface-type"
   constraint.label.font="Dialog-italic-12"
   name.label.font="Dialog-italic-12"
   type.label.font="Dialog-italic-12"/>
  <NodeStyle
   styleId="interface.detailed"
   styleRef="interface"
   name.label.font="Dialog-bolditalic-16"
   stereotype.label.text="«interface»"/>
  <NodeStyle
   styleId="exception.compact"
   styleRef="exception"
   name.label.font="Dialog-bold-13"/>
  <NodeStyle
   styleId="annotation.compact"
   styleRef="annotation"
   shape="ellipse"
   name.label.font="Dialog-bold-13"/>
  <NodeStyle
   styleId="annotation.detailed"
   styleRef="annotation"
   name.label.font="Dialog-bold-16"
   stereotype.label.text="«annotation»"/>
  <NodeStyle
   styleId="class"
   styleRef="class-type"/>
  <NodeStyle
   styleId="exception.detailed"
   styleRef="exception"
   name.label.font="Dialog-bold-16"
   stereotype.label.text="«exception»"/>
  <NodeStyle
   styleId="enum"
   styleRef="class-type"/>
  <NodeStyle
   styleId="abstract.detailed"
   styleRef="abstract"
   constraint.label.text="{abstract}"
   name.label.font="Dialog-bold-16"/>
  <NodeStyle
   styleId="enum.compact"
   styleRef="enum"
   name.label.font="Dialog-bold-13"/>
  <NodeStyle
   styleId="error"
   styleRef="class-type"/>
  <NodeStyle
   styleId="class.detailed"
   styleRef="class"
   name.label.font="Dialog-bold-16"/>
  <NodeStyle
   styleId="error.detailed"
   styleRef="error"
   name.label.font="Dialog-bold-16"
   stereotype.label.text="«error»"/>
  <NodeStyle
   styleId="interface.compact"
   styleRef="interface"
   shape="ellipse"
   name.label.font="Dialog-bolditalic-13"/>
  <NodeStyle
   styleId="class.compact"
   styleRef="class"
   name.label.font="Dialog-bold-13"/>
  <NodeStyle
   styleId="enum.detailed"
   styleRef="enum"
   name.label.font="Dialog-bold-16"
   stereotype.label.text="«enum»"/>
  <NodeStyle
   styleId="error.compact"
   styleRef="error"
   name.label.font="Dialog-bold-13"/>
  <EdgeStyle
   styleId="relationship"
   line.color="#000000"
   line.stroke="line_1"
   bend.style="smooth"
   source.arrow="none"
   target.arrow="none"/>
  <EdgeStyle
   styleId="realization"
   styleRef="relationship"
   line.stroke="dashed_1"
   target.arrow="white_delta"/>
  <EdgeStyle
   styleId="generalization"
   styleRef="relationship"
   target.arrow="white_delta"/>
  <EdgeStyle
   styleId="association"
   styleRef="relationship"
   target.arrow="UML:Wedge"/>
  <EdgeStyle
   styleId="dependency"
   styleRef="relationship"
   line.stroke="dashed_1"
   target.arrow="UML:Wedge"/>
</StyleDefinition>
