<?xml version="1.0" encoding="UTF-8"?>
<StyleDefinition
 xmlns="http://www.yworks.com/xml/ydocstyle"
 xmlns:xsi="http://www.w3.org/2001/XMLSchema-instance"
 xsi:schemaLocation="http://www.yworks.com/xml/ydocstyle http://www.yworks.com/xml/schema/ydoc/1.0/ydocstyle.xsd">
  <NodeStyle
   styleId="node-type"
   shadow.color=""
   shadow.width="0"
   shadow.height="0"
   shadow.style="solid"
   line.color="#000000"
   line.stroke="line_1"
   header.fill.color="#000000"
   header.gradient.color=""
   header.style="default"
   icon.style="ascii"
   separator.fill.color=""
   separator.style="fixed"
   shape="rectangle"
   section.fill.color=""
   section.gradient.color=""
   constraint.label.font="Dialog-plain-12"
   constraint.label.text=""
   constraint.label.text.color="#FFFFFF"
   name.label.font="Dialog-bold-12"
   name.label.text.color="#FFFFFF"
   stereotype.label.font="Dialog-bold-12"
   stereotype.label.text=""
   stereotype.label.text.color="#FFFFFF"
   type.label.font="Dialog-bold-12"
   type.label.text=""
   type.label.text.color="#FFFFFF"
   fields.fill.color=""
   fields.gradient.color=""
   fields.font="Dialog-bold-12"
   fields.text.color="#FFFFFF"
   constructors.fill.color=""
   constructors.gradient.color=""
   constructors.font="Dialog-bold-12"
   constructors.text.color="#FFFFFF"
   methods.fill.color="#CCCCCC"
   methods.gradient.color=""
   methods.font="Dialog-bold-12"
   methods.text.color="#FFFFFF"/>
  <NodeStyle
   styleId="group"
   styleRef="node-type"
   line.color="#B2B2B2"
   header.fill.color="#FFFFFF"
   separator.style="dynamic"
   shape="roundrectangle"
   section.fill.color="#FFFFFF"/>
  <NodeStyle
   styleId="classifier"
   styleRef="node-type"
   line.color="#6FA9FF"
   header.fill.color="#6EA9FF"
   header.gradient.color="#000000"
   header.style="default"
   icon.style="vectorgraphics"
   separator.fill.color="#000000"
   shape="roundrectangle"
   constraint.label.font="Dialog-bold-12"
   fields.fill.color="#666666"
   fields.gradient.color="#000000"
   constructors.fill.color="#666666"
   constructors.gradient.color="#000000"
   methods.fill.color="#666666"
   methods.gradient.color="#000000"/>
  <NodeStyle
   styleId="package"
   styleRef="node-type"
   line.color="#6EA9FF"
   header.fill.color="#000000"
   header.style="left_tab"
   separator.style="dynamic"
   shape="roundrectangle"
   section.fill.color="#333333"/>
  <NodeStyle
   styleId="compact"
   styleRef="classifier"
   header.fill.color="#666666"
   header.style="iconified"
   name.label.font="Dialog-bold-13"/>
  <NodeStyle
   styleId="interface.compact"
   styleRef="compact"
   line.color="#669900"
   shape="ellipse"/>
  <NodeStyle
   styleId="detailed"
   styleRef="classifier"
   name.label.font="Dialog-bold-16"/>
  <NodeStyle
   styleId="class.compact"
   styleRef="compact"/>
  <NodeStyle
   styleId="abstract.compact"
   styleRef="compact"/>
  <NodeStyle
   styleId="enum.detailed"
   styleRef="detailed"
   stereotype.label.text="«enum»"/>
  <NodeStyle
   styleId="interface.detailed"
   styleRef="detailed"
   header.fill.color="#6EA9FF"
   stereotype.label.text="«interface»"/>
  <NodeStyle
   styleId="error.compact"
   styleRef="compact"
   line.color="#CC0000"/>
  <NodeStyle
   styleId="exception.compact"
   styleRef="compact"
   line.color="#CC0000"/>
  <NodeStyle
   styleId="annotation.compact"
   styleRef="compact"
   line.color="#669900"
   shape="ellipse"/>
  <NodeStyle
   styleId="annotation.detailed"
   styleRef="detailed"
   stereotype.label.text="«annotation»"/>
  <NodeStyle
   styleId="exception.detailed"
   styleRef="detailed"
   stereotype.label.text="«exception»"/>
  <NodeStyle
   styleId="abstract.detailed"
   styleRef="detailed"
   constraint.label.text="{abstract}"/>
  <NodeStyle
   styleId="enum.compact"
   styleRef="compact"/>
  <NodeStyle
   styleId="class.detailed"
   styleRef="detailed"/>
  <NodeStyle
   styleId="error.detailed"
   styleRef="detailed"
   stereotype.label.text="«error»"/>
  <EdgeStyle
   styleId="relationship"
   line.color="#999999"
   line.stroke="line_1"
   bend.style="angled"
   source.arrow="none"
   target.arrow="none"/>
  <EdgeStyle
   styleId="realization"
   styleRef="relationship"
   line.stroke="dashed_1"
   target.arrow="white_delta"/>
  <EdgeStyle
   styleId="generalization"
   styleRef="relationship"
   target.arrow="white_delta"/>
  <EdgeStyle
   styleId="association"
   styleRef="relationship"
   target.arrow="UML:Wedge"/>
  <EdgeStyle
   styleId="dependency"
   styleRef="relationship"
   line.stroke="dashed_1"
   target.arrow="UML:Wedge"/>
</StyleDefinition>
